{
  "ok": true,
  "timestamp": "2026-08-19T00:00:00Z",
  "commit": "b7e08b6ef84546e9b3d084a411c3a59e3e4df7c8",
  "phase4_product_baseline": "b7e08b6ef84546e9b3d084a411c3a59e3e4df7c8",
  "device": "Example Device",
  "build": {
    "package": "com.slclash.app.dev",
    "version_name": "0.0.0-example",
    "version_code": "1",
    "mode": "profile",
    "role": "profiling",
    "formal_eligible": true,
    "debuggable": false
  },
  "env": {
    "model": "Example Device",
    "android_version": "15",
    "package": "com.slclash.app.dev",
    "flutter_pid": 1001,
    "remote_pid": null,
    "git_commit": "b7e08b6ef84546e9b3d084a411c3a59e3e4df7c8"
  },
  "errors": [],
  "cold_start": {
    "ok": true,
    "warmup": 2,
    "requested_runs": 10,
    "measured_runs": 10,
    "stats": {
      "count": 10,
      "min": 700,
      "max": 1000,
      "median": 812,
      "p90": 940
    },
    "startup_marks": {
      "runs_with_marks": 10,
      "core_outcome_counts": {
        "core_ready": 0,
        "core_skipped": 10,
        "core_connect_failed": 0,
        "core_init_failed": 0
      },
      "stats": {
        "first_frame": {
          "count": 10,
          "min": 380,
          "max": 520,
          "median": 410,
          "p90": 480
        },
        "main_ready": {
          "count": 10,
          "min": 1500,
          "max": 2200,
          "median": 1800,
          "p90": 2100
        }
      }
    }
  },
  "memory": {
    "ok": true,
    "total_pss_kb": {
      "app": 180000,
      "remote": null,
      "combined": 180000
    }
  },
  "jank": {
    "ok": true,
    "summary": {
      "total_frames": 120,
      "janky_frames": 6,
      "janky_percent": 5.0,
      "p90_ms": 12
    },
    "unreliable": ["idle_only_no_ui_automation"]
  },
  "vpn": {
    "ok": false,
    "start_observable": true,
    "start_to_observable_ms": 800,
    "vpn_ready": null,
    "start_to_ready_ms": null,
    "stop_success": true,
    "stop_to_cleared_ms": 300,
    "notes": [
      "Example: partial signals are observable but not confirmed ready; ready timing stays null."
    ],
    "unreliable": [
      "vpn_consent_cannot_be_granted_over_adb",
      "vpn_ready_unconfirmed_partial_signals_only"
    ]
  },
  "background": {
    "ok": true,
    "vpn_active": false,
    "vpn_inactive": true,
    "unreliable": ["no_battery_mah"]
  },
  "compare": null
}
